590ca0337c459f24986ddf33,890,"Republicans Disregarded the C.B.O., but It Won’t Be Ignored",Upshot,2017-5-5 15:54:00,"The Congressional Budget Office’s verdict, expected next week, may influence the future of the political debate.",https://www.nytimes.com/2017/05/05/upshot/the-house-passed-its-health-care-bill-now-the-scorekeepers-will-weigh-in.html
590cac2e7c459f24986ddf59,620,Farmer’s Market Shopping With the Chef Tom Colicchio,Well,2017-5-5 16:45:00,"A top chef’s advice: To avoid wasting food, just buy the produce you’ll cook for tonight’s dinner.",https://www.nytimes.com/2017/05/05/well/eat/farmers-market-shopping-with-the-chef-tom-colicchio.html
590caca07c459f24986ddf5c,1255,‘The Handmaid’s Tale’ Episode 4 Recap: Survival Lessons,Culture,2017-5-5 16:47:00,Moira proves to be the inspiration Offred needs to resist the strictures of Gilead.,https://www.nytimes.com/2017/05/05/arts/television/handmaids-tale-recap-nolite-te-bastardes-carborundorum.html
590cb2127c459f24986ddf6e,1195,"At $495, a Signature Shoe  Is Met With Headshakes",Sports,2017-5-5 17:10:00,The price tag for the least expensive model doesn’t go over well as the basketball star and his father try a different business model.,https://www.nytimes.com/2017/05/05/sports/basketball/lonzo-lavar-ball-shoes-zo2.html
590cd4bd7c459f24986ddfdd,251,"The Story Was Fine, the Headline Less So",Editorial,2017-5-5 19:38:00,Readers were quick to point out that a headline fell short in conveying the potential impact of the Republican health care bill.,https://www.nytimes.com/2017/05/05/public-editor/healthcare-republicans-poor-headline-liz-spayd.html
590cdcb87c459f24986ddff4,1250,"Many Ask for Asylum, But It’s Rarely Granted",National,2017-5-5 20:12:00,"Despite Senator Bob Casey’s efforts, a mother and child fleeing gang violence in Honduras learn a hard truth: It’s been tough for years to win asylum.",https://www.nytimes.com/2017/05/05/us/honduras-mother-son-deported-bob-casey.html
590ce5867c459f24986de00c,560,"Trump’s 2nd Nominee for Army Secretary Withdraws, Citing ‘Misleading’ Attacks",National,2017-5-5 20:50:00,"Mark E. Green, a Tennessee state senator and former Army surgeon, said his nomination had become a distraction because of “false and misleading attacks.”",https://www.nytimes.com/2017/05/05/us/politics/mark-green-army-secretary-nominee-withdraws.html
590cf9227c459f24986de051,1302,"Leaving College, Going to War",OpEd,2017-5-5 22:13:00,"Fifty years ago, I was about to graduate — and get drafted into Vietnam.",https://www.nytimes.com/2017/05/05/opinion/leaving-college-going-to-war.html
590cff457c459f24986de064,740,Locked Up for Being Poor,Editorial,2017-5-5 22:39:00,A federal judge rules that the routine use of cash bail unconstitutionally harms the poor.,https://www.nytimes.com/2017/05/05/opinion/locked-up-for-being-poor.html
590d01c67c459f24986de06b,1426,Macron Campaign Says It Was Hit by ‘Massive’ Hacking Attack,Foreign,2017-5-5 22:50:00,"A trove of internal campaign documents was posted online, campaign staff for the French presidential candidate said.",https://www.nytimes.com/2017/05/05/world/europe/france-macron-hacking.html
590d0f967c459f24986de084,1093,"Red Sox, Racism and Adam Jones",OpEd,2017-5-5 23:49:00,"After the incident at Fenway, it was easy for me to say, “Of course — Boston.” But it’s more complicated than that.",https://www.nytimes.com/2017/05/05/opinion/red-sox-racism-and-adam-jones.html
590d27117c459f24986de0ac,829,Where’s Ivanka When We Need Her?,OpEd,2017-6-5 1:29:00,Reproductive rights go all wrong in Washington.,https://www.nytimes.com/2017/05/05/opinion/wheres-ivanka-when-we-need-her.html
590d29c27c459f24986de0ae,812,What Has  Failed In France,OpEd,2017-6-5 1:41:00,It is desperate for reform — and desperate not to be reformed.,https://www.nytimes.com/2017/05/05/opinion/what-has-failed-in-france.html
590d2e287c459f24986de0b3,474,Center of a Blowout,Games,2017-6-5 2:00:00,Joe DiPietro offers us a tough Saturday puzzle.,https://www.nytimes.com/2017/05/05/crosswords/center-of-a-blowout.html
590d40467c459f24986de0c4,831,Ivanka Trump’s Collectible Quotations,OpEd,2017-6-5 3:17:00,The first daughter’s book reads like a demented 12-year-old’s Tumblr feed.,https://www.nytimes.com/2017/05/05/opinion/sunday/ivanka-trumps-collectible-quotations.html
590db2257c459f24986de121,1021,"A Trillion-Dollar Student Debt, With Mounting Risks",SundayBusiness,2017-6-5 11:23:00,Americans owe more than a trillion dollars in student debt. Regulatory changes by the Trump administration are taking us in the wrong direction.,https://www.nytimes.com/2017/05/06/upshot/the-wrong-way-to-fix-student-loans.html
590dd6f07c459f24986de142,379,A Co-op Renovation Project Is Frustrating to Neighbors,RealEstate,2017-6-5 14:00:00,A neighbor’s renovation is making our lives miserable and the co-op board won’t do anything.,https://www.nytimes.com/2017/05/06/realestate/noise-construction-building-renovation.html
590de3fd7c459f24986de15a,757,The ‘Greatest Two Minutes in Sport’,Insider,2017-6-5 14:55:00,“It is one of the few days of the year when I wear a sports coat.”,https://www.nytimes.com/2017/05/06/insider/reporter-preps-for-kentucky-derby-horse-racing-betting.html
590df3097c459f24986de16b,214,Variety Puzzle: Split Decisions,Games,2017-6-5 16:00:00,Fred Piscop’s Split Decisions is good practice for letting your brain fill in missing information.,https://www.nytimes.com/2017/05/06/crosswords/variety-puzzle-split-decisions.html
590df7777c459f24986de175,1483,"Democrats Pounce, Seeing Path to Retake House",National,2017-6-5 16:18:00,"House Republicans, already set to play defense in 2018 because of their unpopular president, must now contend with an energized, angry Democratic Party.",https://www.nytimes.com/2017/05/06/us/politics/health-care-vote.html
590df96a7c459f24986de179,1611,Hacking Gives Final Jolt  To France’s Chaotic Race,Foreign,2017-6-5 16:27:00,"In a deeply divided country, some ask whether either Emmanuel Macron or Marine Le Pen will have enough authority to actually govern.",https://www.nytimes.com/2017/05/06/world/europe/france-election-emmanuel-macron-marine-le-pen.html
590df9f47c459f24986de17b,981,Kushner’s Sister Highlights Family Ties in Pitch to Wealthy Chinese Investors,Foreign,2017-6-5 16:29:00,"Nicole Meyer sought $150 million for a Jersey City, N.J., housing development from more than 100 investors gathered at the Ritz-Carlton in Beijing.",https://www.nytimes.com/2017/05/06/world/asia/jared-kushner-sister-nicole-meyer-china-investors.html
590e04137c459f24986de190,910,"In China, the Party  Keeps the Band Going",Foreign,2017-6-5 17:12:00,"A clean-cut, patriotic schoolboy image has propelled TFBoys to the top of China’s charts and into the good graces of its Communist leaders.",https://www.nytimes.com/2017/05/06/world/asia/china-tfboys-boy-band.html
590e0c677c459f24986de19b,1149,"Despite the Fading of Star Players, the Spurs’ Future Remains Bright",Sports,2017-6-5 17:48:00,The Spurs have lost their longtime guard Tony Parker for the rest of the playoffs. Guard Manu Ginobili is 39. The star center Tim Duncan has retired. But the San Antonio way continues to attract talent.,https://www.nytimes.com/2017/05/06/sports/basketball/nba-playoffs-san-antonio-spurs-future.html
590e11637c459f24986de1a3,943,Macron et la défense de la République,OpEd,2017-6-5 18:09:00,Marine Le Pen précipiterait la France dans un bourbier. La rénovation de son parti est une imposture: le Front National est toujours un parti raciste.,https://www.nytimes.com/2017/05/06/opinion/macron-et-la-defense-de-la-republique.html
590e16317c459f24986de1a9,830,A Christian Abortion Doctor,OpEd,2017-6-5 18:30:00,"“I believe that as an abortion provider, I am doing God’s work,” Dr. Parker says.",https://www.nytimes.com/2017/05/06/opinion/sunday/meet-dr-willie-parker-a-southern-christian-abortion-provider.html
590e16527c459f24986de1ab,794,Two Ex-Candidates Stuck in Time,Editorial,2017-6-5 18:30:00,The campaign was last year: It’s past time for the contenders to recall their duty to help a divided America to heal and move on.,https://www.nytimes.com/2017/05/06/opinion/two-presidential-candidates-stuck-in-time.html
590e16587c459f24986de1af,1115,Hillary Clinton’s Absolution,OpEd,2017-6-5 18:30:00,"With nothing left to lose, can she find herself?",https://www.nytimes.com/2017/05/06/opinion/sunday/hillary-clintons-absolution.html
590e16587c459f24986de1b0,926,Trump: Hazardous to Our Health,OpEd,2017-6-5 18:30:00,Our salesman in chief celebrates hawking a shoddy product.,https://www.nytimes.com/2017/05/06/opinion/sunday/trump-hazardous-to-our-health.html
590e16957c459f24986de1b8,809,House Republicans Go Off the Cliff,OpEd,2017-6-5 18:31:00,Will the Senate be there to catch them?,https://www.nytimes.com/2017/05/06/opinion/house-republicans-go-off-the-cliff.html
590e168e7c459f24986de1b2,965,Don’t Let Facebook Make You Miserable,OpEd,2017-6-5 18:31:00,Raw Google search data proves that we are not who we say we are on social media.,https://www.nytimes.com/2017/05/06/opinion/sunday/dont-let-facebook-make-you-miserable.html
590e168e7c459f24986de1b3,1224,How Censorship Works,OpEd,2017-6-5 18:31:00,Those who remain silent to please the authorities make China’s brutal system possible.,https://www.nytimes.com/2017/05/06/opinion/sunday/ai-weiwei-how-censorship-works.html
590e16947c459f24986de1b4,1123,A New Entrant in the Fact-Check Biz,Editorial,2017-6-5 18:31:00,The paper has started a new unit aimed at holding politicians’ feet to the fire.,https://www.nytimes.com/2017/05/06/public-editor/a-late-entry-by-the-times-into-the-fact-check-biz.html
590e16947c459f24986de1b6,1695,The Hidden Radicalism of Southern Food,OpEd,2017-6-5 18:31:00,"By starting a community farm and a pig co-op, Fannie Lou Hamer pointed the way toward food sovereignty.",https://www.nytimes.com/2017/05/06/opinion/sunday/the-hidden-radicalism-of-southern-food.html
590e16947c459f24986de1b7,1253,The Health Care Disaster Is Really About Taxes,OpEd,2017-6-5 18:31:00,"For Republicans, governing seems to mean cutting taxes and nothing else.",https://www.nytimes.com/2017/05/06/opinion/sunday/the-house-health-care-disaster-is-really-about-taxes.html
590e479b7c459f24986de1ef,905,Duality Quality,Games,2017-6-5 22:00:00,"Natan Last, Finn Vigeland and the members of the Jewish Association Serving the Aging crossword class highlight an interesting aspect of the English language.",https://www.nytimes.com/2017/05/06/crosswords/duality-quality.html
590e8b8b7c459f24986de221,647,"9 Letters: Starts With C, Ends With D",Insider,2017-7-5 2:50:00,"That’s a clue to one of the Sunday classes offered by the Jewish Association Serving the Aging, or JASA.",https://www.nytimes.com/2017/05/06/insider/new-york-times-jasa-crossword-puzzle.html
590efe8a7c459f24986de283,1505,"Confederate Monuments Fall, and Tempers Flare",National,2017-7-5 11:01:00,"The city has already taken down one monument, but crane companies in the region are receiving threats over the removal of three others.",https://www.nytimes.com/2017/05/07/us/new-orleans-monuments.html
590f21767c459f24986de2a4,1134,A Towering Monument to Jesus in the City of Mao,Foreign,2017-7-5 13:30:00,"A big Protestant church in the city where Mao Zedong spent his youth has infuriated his most fervent admirers in China, but the city’s residents mostly shrug.",https://www.nytimes.com/2017/05/07/world/asia/china-changsha-christian-church-park.html
590f427a7c459f24986de2d2,964,"After Harvey Is Disciplined, The Marlins Punish His Fill-In",Sports,2017-7-5 15:51:00,"Adam Wilk, who took the baseball on short notice after Harvey was suspended for three games after violating team rules, gave up six runs in a 7-0 drubbing.",https://www.nytimes.com/2017/05/07/sports/baseball/mets-matt-harvey-suspended-3-days.html
590f61247c459f24986de300,1341,"France Elects Macron President, Shunning an Emergent Far Right",Foreign,2017-7-5 18:02:00,Emmanuel Macron’s victory suggested that his call for a new centrist approach to politics had handily defeated the nationalism of Marine Le Pen.,https://www.nytimes.com/2017/05/07/world/europe/emmanuel-macron-france-election-marine-le-pen.html
590f98b97c459f24986de365,467,France Elects Emmanuel Macron,Editorial,2017-7-5 21:59:00,"The young political centrist won a strong victory over the extreme rightist Marine Le Pen, but still faces a challenge in governing a divided country.",https://www.nytimes.com/2017/05/07/opinion/france-elects-emmanuel-macron.html
590f98f57c459f24986de366,268,Modern Movement Initialism,Games,2017-7-5 22:00:00,A puzzle by Zhouqin Burnikel that gives voice to a group of people.,https://www.nytimes.com/2017/05/07/crosswords/modern-movement-initialism.html
590f9edc7c459f24986de373,1495,"A Steady, if Bland, Voice",Foreign,2017-7-5 22:25:00,"Emmanuel Macron’s victory brought joy from Europe’s political establishment, as he managed to stem the populist tide that has roiled the West.",https://www.nytimes.com/2017/05/07/world/europe/why-macron-won-france.html
590fb5087c459f24986de38e,230,"Strangers, and Cookies, on a Train",Metro,2017-8-5 0:00:00,Sharing some macarons liberated from a corporate party with fellow subway passengers.,https://www.nytimes.com/2017/05/07/nyregion/metropolitan-diary-strangers-and-cookies-on-a-train.html
590fba797c459f24986de394,848,A new hope for Europe’s road ahead,OpEd,2017-8-5 0:23:00,Hold the Marseillaise! Time for the “Ode to Joy.”,https://www.nytimes.com/2017/05/07/opinion/macron-and-the-revival-of-europe.html
590fc1837c459f24986de39f,906,"With Drastic Measures, Mets Call Attention to Drastic Times",Sports,2017-8-5 0:53:00,"By telling Matt Harvey he was suspended for a rules violation on the morning of a scheduled start, the Mets chastised a pitcher on whom they once relied.",https://www.nytimes.com/2017/05/07/sports/baseball/new-york-mets-matt-harvey-suspension.html
590fc3307c459f24986de3a1,828,Trump to Announce a Slate of Conservative Nominees to the Federal Courts,National,2017-8-5 1:00:00,The nominations of 10 judges to the lower courts are the first in what could be near monthly waves of announcements to fill more than 120 vacancies.,https://www.nytimes.com/2017/05/07/us/politics/trump-lower-court-nominees-conservatives.html
590fc8af7c459f24986de3a6,1192,"After Boko Haram Releases 82 Girls, Parents Wait in Anguish",Foreign,2017-8-5 1:23:00,"Following years of rumors, Nigeria confirmed that 82 girls who had been taken were released. But many parents still had no idea if their daughters were among them.",https://www.nytimes.com/2017/05/07/world/africa/nigeria-chibok-boko-haram-.html
590fd12b7c459f24986de3ae,1411,"‘The Leftovers’ Season 3, Episode 4: Disappearing Act",Culture,2017-8-5 2:00:00,This week’s episode is one of the more emotionally draining hours the show has ever aired — which is saying something.,https://www.nytimes.com/2017/05/07/arts/television/the-leftovers-recap-gday-melbourne.html
590fdf3b7c459f24986de3ba,1011,‘Billions’ Season 2 Finale Recap: Alien vs. Predator,Culture,2017-8-5 3:00:00,"No good can come from monsters like Chuck and Axe doing battle, particularly for the people closest to them.",https://www.nytimes.com/2017/05/07/arts/television/billions-recap-ball-in-hand.html
591017977c459f24986de40a,1717,Rikers Tumult Rises: Monitor Accused of Spying,Metro,2017-8-5 7:00:00,"New York City’s Department of Investigation said the jail system’s chief watchdog had listened in on inmate calls with an investigator, people with knowledge of the matter said.",https://www.nytimes.com/2017/05/08/nyregion/rikers-island-jail-spying-gregory-kuczinski.html
59101c697c459f24986de418,638,Seersucker and Civility,OpEd,2017-8-5 7:21:00,"Etiquette books like the one we receive as freshmen may seem outdated, but old rules about manners still apply today.",https://www.nytimes.com/2017/05/08/opinion/seersucker-and-civility.html
59101c797c459f24986de41d,818,We Must Support Human Rights,OpEd,2017-8-5 7:21:00,I have seen the worst the world can offer. That’s why I believe the United States needs to protect what is good.,https://www.nytimes.com/2017/05/08/opinion/john-mccain-rex-tillerson-human-rights.html
59101c797c459f24986de41e,819,Republicans  Party Like  It’s 1984,OpEd,2017-8-5 7:21:00,Making policy by lying about everything.,https://www.nytimes.com/2017/05/08/opinion/republicans-party-like-its-1984.html
59101c7f7c459f24986de421,797,A Disaster Wrapped In Victory,OpEd,2017-8-5 7:21:00,"With the health care vote, the House G.O.P. has made the rest of its agenda harder to achieve.",https://www.nytimes.com/2017/05/08/opinion/gop-health-care-disaster-wrapped-in-victory.html
59101c7f7c459f24986de420,836,Republican Death Wish,OpEd,2017-8-5 7:21:00,The health care bill poses a threat to many Americans and is a death wish from the politicians who passed it.,https://www.nytimes.com/2017/05/08/opinion/republican-death-wish.html
5910264d7c459f24986de43d,910,Unknown,Unknown,2017-8-5 8:00:00,"A new generation of African artists, inspired by their predecessors and helped by technology, has been redefining how Africans look at themselves.",https://lens.blogs.nytimes.com/2017/05/08/looking-at-new-generations-of-african-photographers/
59103aa27c459f24986de46b,687,"What’s Going On in This Picture? | May 8, 2017",Learning,2017-8-5 9:30:00,"Look closely at this image, stripped of its caption, and join the moderated conversation about what you and other students see.",https://www.nytimes.com/2017/05/08/learning/whats-going-on-in-this-picture-may-8-2017.html
59103aa37c459f24986de46c,1025,An Election Review: There’s Reason to Be Skeptical of a Comey Effect,Upshot,2017-8-5 9:30:00,"Some polls showing a Clinton decline, including one by The Upshot, were conducted before the letter by James Comey was released.",https://www.nytimes.com/2017/05/08/upshot/a-2016-review-theres-reason-to-be-skeptical-of-a-comey-effect.html
591041ab7c459f24986de484,1048,How to Lower Breast Cancer Risk,Science,2017-8-5 10:00:00,Certain health habits may keep breast cancer at bay and help to ward off other life-threatening ills.,https://www.nytimes.com/2017/05/08/well/live/how-to-lower-breast-cancer-risk.html
591041b17c459f24986de485,1143,The Birth of a Mother,Well,2017-8-5 10:00:00,Becoming a mother is one of the most significant physical and psychological changes a woman will ever experience.,https://www.nytimes.com/2017/05/08/well/family/the-birth-of-a-mother.html
591041aa7c459f24986de483,1228,More Seniors Shun Marriage,Science,2017-8-5 10:00:00,"Cohabitation is on the rise among older people, demographers report, driven by both personal and economic considerations.",https://www.nytimes.com/2017/05/08/health/older-americans-unmarried-couples.html
591042287c459f24986de486,1226,"New York Today: Treasures Left, Not Lost, on the Subway",Metro,2017-8-5 10:02:00,"Monday: Books on the Subway, a sanctuary Hindu temple, and a request to reinvent public spaces.",https://www.nytimes.com/2017/05/08/nyregion/new-york-today-treasures-left-not-lost-on-the-subway.html
591049877c459f24986de49c,430,Should Confederate Statues Be Removed or Remain in Place?,Learning,2017-8-5 10:33:00,What issues arise when today’s leaders consider removing statues of historical leaders whose values and beliefs have not stood the test of time?,https://www.nytimes.com/2017/05/08/learning/should-confederate-statues-be-removed-or-remain-in-place.html
59104fc37c459f24986de4a7,736,A Medicare Drug Incentive That Leads to Greater Hospitalizations,Upshot,2017-8-5 11:00:00,Higher co-payments in some plans mean that fewer people are taking drugs that are needed to keep them out of the hospital.,https://www.nytimes.com/2017/05/08/upshot/a-medicare-drug-incentive-that-leads-to-greater-hospitalizations.html
59105a4a7c459f24986de4be,3385,Keith Olbermann Was Once Cable News’s Liberal Standard-Bearer. Now He’s Missing Its Boom Times.,Magazine,2017-8-5 11:45:00,"Since November, viewers have flocked to liberal commentators on cable news — while Olbermann, who pioneered the field, rails against Trump from a GQ photo studio.",https://www.nytimes.com/2017/05/08/magazine/keith-olbermann-was-once-cable-newss-liberal-standard-bearer-now-hes-missing-its-boom-times.html
5910703f7c459f24986de4e8,1149,Why a Hacking Attack Failed to Sway the French Vote for President,Foreign,2017-8-5 13:18:00,"The fallout was contained, partly because of a news blackout, and partly because France lacks an equivalent to Fox News.",https://www.nytimes.com/2017/05/08/world/europe/macron-hacking-attack-france.html
591084547c459f24986de51e,1238,"Machu Picchu, With Little Money and Less Time",Travel,2017-8-5 14:44:00,"A visit to the 15th-century Incan estate as a day trip from Cuzco requires extra preparation, but you can do it, unrushed.",https://www.nytimes.com/2017/05/08/travel/machu-picchu-cheap-easy-day-trip-cuzco.html
591093fd7c459f24986de547,726,Unknown,National,2017-8-5 15:51:00,Former President Barack Obama warned Donald J. Trump in their conversation in the Oval Office two days after the election.,https://www.nytimes.com/2017/05/08/us/politics/obama-flynn-trump.html
591094687c459f24986de54a,602,How We Beat the House — in Tallying the Health Care Vote,Insider,2017-8-5 15:52:00,"The project started with a simple question from a Times graphics editor, Tom Giratikanon: “What is the fastest we can get votes from Congress onto our website?”",https://www.nytimes.com/2017/05/08/insider/how-we-beat-the-house-in-tallying-the-health-care-vote.html
59109b547c459f24986de560,755,"Blocked by China, Taiwan Presses to Join the World Health Assembly’s Annual Meeting",Foreign,2017-8-5 16:22:00,Taiwan’s president and ministers want the self-ruled island to have observer status at the World Health Assembly’s annual meeting in Geneva.,https://www.nytimes.com/2017/05/08/world/asia/taiwan-world-health-china-.html
5910a8857c459f24986de586,569,Surprise! It Has No Whiskey. Yet.,Dining,2017-8-5 17:18:00,"Trying to improve the image of a much-derided drink, its makers are planning a reboot, with the spirit many people think it already contains.",https://www.nytimes.com/2017/05/08/dining/southern-comfort-whiskey.html
5910bbed7c459f24986de5d3,399,"He Can Cook, Too, So Why Not Marry Harry?",Culture,2017-8-5 18:41:00,This good-natured York Theater Company musical matches a jilted bride and a restaurant worker with big dreams.,https://www.nytimes.com/2017/05/08/theater/review-he-can-cook-too-so-why-not-marry-harry.html
5910d60f7c459f24986de61d,637,Mr. Right Could Be Under the Frozen Peas,Culture,2017-8-5 20:33:00,‘Ernest Shackleton Loves Me’ raises a trekker from the dead as a heartthrob in this spunky new musical.,https://www.nytimes.com/2017/05/08/theater/review-could-a-long-gone-antarctic-explorer-be-mr-right.html
5910da337c459f24986de62a,1205,A Cry for Help as a Witness Recounts a Man’s Fall Onto the Subway Tracks,Metro,2017-8-5 20:50:00,A reporter recounts what happened when a homeless man fell to the tracks at an F train station in New York on a Saturday afternoon.,https://www.nytimes.com/2017/05/08/nyregion/help-him-up-a-witnesss-account-of-panic-on-a-subway-platform.html
5910eb847c459f24986de64d,349,"Maple, the New York Start-Up, Has Delivered Its Last Meal",Dining,2017-8-5 22:04:00,"The service, in which the chef David Chang was an investor, has been sold to Deliveroo, a larger company, in London.",https://www.nytimes.com/2017/05/08/dining/maple-sold-to-deliveroo.html
5911068e7c459f24986de681,207,Bus Pass,Metro,2017-9-5 0:00:00,Running late for a special date and getting a little help.,https://www.nytimes.com/2017/05/08/nyregion/metropolitan-diary-bus-pass.html
59110bc67c459f24986de693,1438,Data Crunchers Ask New Yorkers: How Are the Police Doing?,Metro,2017-9-5 0:22:00,"CompStat will send New Yorkers questions on their smartphones to see if they feel safe, if they trust the police and if they are confident in the department.",https://www.nytimes.com/2017/05/08/nyregion/nypd-compstat-crime-mapping.html
591115817c459f24986de69c,1015,Misery and Misfortune Aplenty,Sports,2017-9-5 1:03:00,"San Francisco, which was just outscored by 26 runs in a three-game sweep by the Reds, has lost its ace pitcher, Madison Bumgarner, and ranks near the bottom of the majors in runs scored and E.R.A.",https://www.nytimes.com/2017/05/08/sports/baseball/san-francisco-giants-season-misery-misfortune.html
591119917c459f24986de6a8,629,The Kushners and Their Golden Visas,Editorial,2017-9-5 1:21:00,The president’s in-laws promise Chinese investors green cards. The real scandal is that it’s legal.,https://www.nytimes.com/2017/05/08/opinion/the-kushners-and-their-golden-visas.html
591119d57c459f24986de6a9,964,"In Shift, Prosecutors Are Taking a Tougher Stance in Fraternity Hazing Deaths",National,2017-9-5 1:22:00,"Eighteen Penn State students have been charged in the death of a sophomore: a case that, not so long ago, might have resulted only in hand-wringing.",https://www.nytimes.com/2017/05/08/us/penn-state-prosecutors-fraternity-hazing-deaths.html
59111c427c459f24986de6ac,1276,"White House Knew Flynn Lied, Ex-Official Testifies",National,2017-9-5 1:32:00,"Ms. Yates, the former acting attorney general, gave a dramatic account of an unfolding crisis in the early days of President Trump’s White House.",https://www.nytimes.com/2017/05/08/us/politics/michael-flynn-sally-yates-hearing.html
591122ac7c459f24986de6b2,521,Filled With Tiny Bubbles,Games,2017-9-5 2:00:00,The return of Peter A. Collins.,https://www.nytimes.com/2017/05/08/crosswords/filled-with-tiny-bubbles.html
