59099c297c459f24986dd6ab,1480,Bret Stephens Takes On Climate Change. Readers Unleash Their Fury.,Editorial,2017-3-5 9:00:00,The New York Times’s new Op-Ed writer drew a strong reaction when he questioned the data on climate science in his first column. Now what?,https://www.nytimes.com/2017/05/03/public-editor/bret-stephens-climate-change-liz-spayd-public-editor.html
59099c297c459f24986dd6ac,1331,Comey Stands By F.B.I.’s Disclosure That Jolted Race,National,2017-3-5 9:00:00,The F.B.I. director spoke publicly for the first time about his decisions about the Hillary Clinton email inquiry in the days before the election.,https://www.nytimes.com/2017/05/03/us/politics/james-comey-fbi-senate-hearing.html
59099c2f7c459f24986dd6b0,1556,Assembly Required,Magazine,2017-3-5 9:00:00,A confluence of political and economic forces has prompted Europe’s largest airplane manufacturer to place a factory in Alabama — and to create one of the world’s most gargantuan supply chains.,https://www.nytimes.com/2017/05/03/magazine/a-look-inside-airbuss-epic-assembly-line.html
59099e5a7c459f24986dd6bd,1064,Can Labour return from the brink?,OpEd,2017-3-5 9:09:00,"As dire as the party’s electoral rout in 1983 was, there was a clear path to recovery. Now, not so much.",https://www.nytimes.com/2017/05/03/opinion/roy-hattersley-britain-election-labour-party-jeremy-corbyn.html
5909a33a7c459f24986dd6c9,1664,Hamilton’s Caribbean Island,Travel,2017-3-5 9:30:00,"Though he left as a teenager, and never returned, his tragic childhood on St. Croix informed his entire life.",https://www.nytimes.com/2017/05/03/travel/st-croix-virgin-islands-alexander-hamilton.html
5909aa2d7c459f24986dd6dd,275,How to Be Mindful at the Doctor’s Office,Well,2017-3-5 10:00:00,Have a better experience at your next doctor’s appointment by being more mindful.,https://www.nytimes.com/2017/05/03/well/mind/how-to-be-mindful-at-the-doctors-office.html
5909aa2c7c459f24986dd6dc,919,Child’s Play Is Good for All of Us,Well,2017-3-5 10:00:00,"If all sedentary children started exercising every day, the United States could save $120 billion a year, a study found.",https://www.nytimes.com/2017/05/03/well/move/childs-play-is-good-for-all-of-us.html
5909ab9e7c459f24986dd6e5,1278,New York Today: Past Presidential Visits,Metro,2017-3-5 10:06:00,"Wednesday: When the president came to New York, Tony Awards nominations, and Brooklyn’s Green-Wood Cemetery.",https://www.nytimes.com/2017/05/03/nyregion/new-york-today-past-presidential-visits.html
5909c65d7c459f24986dd727,216,"Tell Us: What Commercials Do You Love, Hate, or Love to Hate?",Business,2017-3-5 12:00:00,"We want to explore which commercials push our readers’ buttons, and then ask the people who created the ads just what they had in mind.",https://www.nytimes.com/2017/05/03/business/media/tell-us-what-commercials-do-you-love-hate-or-love-to-hate.html
5909e69a7c459f24986dd78f,939,How to Prepare for an Automated Future: Learn How to Learn,Upshot,2017-3-5 14:17:00,A third of respondents who work in education and technology said new schooling would not emerge in time to train workers for jobs of the future.,https://www.nytimes.com/2017/05/03/upshot/how-to-prepare-for-an-automated-future.html
5909efa87c459f24986dd7b9,1292,G.O.P. Leader Says Revised Care Bill Has Votes to Pass,National,2017-3-5 14:56:00,"A vote was scheduled for Thursday, and the majority leader sounded confident about its chances, as critics called the added funding inadequate.",https://www.nytimes.com/2017/05/03/us/politics/gop-eyes-8-billion-addition-to-win-a-crucial-vote-to-the-latest-health-bill.html
5909ff047c459f24986dd7f9,234,Dieting: No Magic in Fasting,Science,2017-3-5 16:02:00,"Alternate-day fasting has gained some popularity as a weight-loss technique, but it works no better than ordinary calorie restriction.",https://www.nytimes.com/2017/05/03/well/eat/fasting-offers-no-special-weight-loss-benefits.html
5909ff417c459f24986dd7fa,220,Nutrition: Fruit and Diabetes Risk,Science,2017-3-5 16:02:00,"A large study has found that eating fresh fruit reduces the risk for developing diabetes, and the risk for its complications.",https://www.nytimes.com/2017/05/03/well/eat/fruit-may-have-benefits-for-diabetes.html
590a26dd7c459f24986dd886,908,An immoral preference for Christian refugees,OpEd,2017-3-5 18:52:00,Selecting refugees based on their spiritual beliefs is a form of state-approved prejudice.,https://www.nytimes.com/2017/05/03/opinion/australias-immoral-preference-for-christian-refugees.html
590a2dc37c459f24986dd8a7,1042,Anger Takes Center Stage As French Rivals Debate,Foreign,2017-3-5 19:21:00,The country’s only presidential debate was more like an angry American-style television shoutfest than the reasoned discussion the French are used to.,https://www.nytimes.com/2017/05/03/world/europe/marine-le-pen-emmanuel-macron-france-presidential-debate.html
590a43137c459f24986dd8ef,461,Nervous Rich People on a Not-So-Lazy Saturday,Culture,2017-3-5 20:52:00,"This revival of J. B. Priestley’s 1932 comedy depicts a busy Saturday in the life of a harried, financially imperiled aristocrat.",https://www.nytimes.com/2017/05/03/theater/the-roundabout-review.html
590a4e5b7c459f24986dd90b,678,James Comey Is ‘Mildly Nauseous’ About the Election. It’s Not Enough.,OpEd,2017-3-5 21:40:00,The director of the F.B.I. just took understatement to a whole new level.,https://www.nytimes.com/2017/05/03/opinion/james-comey-fbi-mildly-nauseous.html
590a628d7c459f24986dd941,961,Will the Extra Billions Be Enough?,Upshot,2017-3-5 23:06:00,Adding $8 billion to a G.O.P. bill seems to fall short of ensuring that those with pre-existing conditions will still be able to get health insurance.,https://www.nytimes.com/2017/05/03/upshot/extra-billions-for-health-bill-researchers-say-its-still-not-enough.html
590a6f0b7c459f24986dd964,132,"A Common Word, but Not a Common Name",Metro,2017-4-5 0:00:00,An explanation for why a student did not respond when attendance was being taken at a Brooklyn high school in the 1940s.,https://www.nytimes.com/2017/05/03/nyregion/metropolitan-diary-a-common-word-but-an-uncommon-name.html
590a74ca7c459f24986dd971,841,  Two Red Bull Teams in Champions League? Rules Say ...,Sports,2017-4-5 0:24:00,RB Leipzig is confident it will be able to compete in next year’s Champions League despite a relationship with the Austrian champion Red Bull Salzburg that could violate UEFA rules.,https://www.nytimes.com/2017/05/03/sports/soccer/room-for-two-red-bulls-soccer-success-complicates-champions-league.html
590a76197c459f24986dd972,395,"On New Planes, American Airlines Will Add Seats and Reduce Space",Travel,2017-4-5 0:30:00,"The company plans to shrink space between rows in its economy section, bringing it closer to low-cost competitors.",https://www.nytimes.com/2017/05/03/travel/new-planes-american-airlines-will-add-seats-reduce-space.html
590a7ad57c459f24986dd97c,1344,"For Mets, It’s Injury After Injury, Year After Year",Sports,2017-4-5 0:50:00,"Recent injuries to Noah Syndergaard and Yoenis Cespedes make them the latest key players to be lost for long stretches, continuing a yearslong issue.",https://www.nytimes.com/2017/05/03/sports/baseball/for-the-mets-its-injury-after-injury-year-after-year.html
590a886a7c459f24986dd989,717,The New Study That Shows Trumpcare’s Damage,OpEd,2017-4-5 1:48:00,New data makes the Republicans’ health care bill look even worse than the Congressional Budget Office’s analysis.,https://www.nytimes.com/2017/05/03/opinion/trump-health-care.html
590a8b3a7c459f24986dd992,1141,Winter Driving Hazard,Games,2017-4-5 2:00:00,Loren Muse Smith and Tracy Gray try to slip one by us.,https://www.nytimes.com/2017/05/03/crosswords/winter-driving-hazard.html
590a8b3a7c459f24986dd993,637,When Ghosts Draw You Close,Weekend,2017-4-5 2:00:00,O’Neill’s Civil War-era Greek tragedy is infused with new relevance in a production directed by David Herskovits.,https://www.nytimes.com/2017/05/03/theater/mourning-becomes-electra-review.html
590a993d7c459f24986dd9a5,1276,"‘Fargo’ Season 3, Episode 3 Recap: The Yanagita Effect",Culture,2017-4-5 3:00:00,It takes impressive swagger for a show to spend an entire episode chasing a red herring. But the gamble pays off.,https://www.nytimes.com/2017/05/03/arts/television/fargo-recap-the-law-of-non-contradiction.html
590ad1a27c459f24986dda13,1470,The Team That Opponents Fear to Play,Sports,2017-4-5 7:00:00,"After some F.C. Porto ultras joined a lower-division team in Portugal, opponents — citing on-field violence and off-field threats — boycotted it.",https://www.nytimes.com/2017/05/04/sports/soccer/the-soccer-team-no-one-wants-to-play.html
590ad66b7c459f24986dda20,871,The Power of Trump’s Bully Pulpit,OpEd,2017-4-5 7:21:00,Donald Trump is a dealmaker. That means his hyperbolic statements are often just the opening bid.,https://www.nytimes.com/2017/05/04/opinion/donald-trump-foreign-policy.html
590ad66b7c459f24986dda1e,923,Senators Save the Empire,Editorial,2017-4-5 7:21:00,The Senate may be our rampart against Trump.,https://www.nytimes.com/2017/05/04/opinion/senator-donald-trump.html
590ad66b7c459f24986dda1c,855,Climate of Unintended Consequences,OpEd,2017-4-5 7:21:00,Do-something impulses and eco-cure boosterism turbocharged by government and subsidized business can do great harm.,https://www.nytimes.com/2017/05/04/opinion/climate-policy-ethanol.html
590ad66b7c459f24986dda1d,827,Way Too Many Trumps,OpEd,2017-4-5 7:21:00,"Out of the blue, the president suddenly showed new sides of himself.",https://www.nytimes.com/2017/05/04/opinion/too-many-donald-trumps.html
590ad66b7c459f24986dda1f,759,Let Penn Station Breathe,Editorial,2017-4-5 7:21:00,An architect gives Gov. Andrew Cuomo his best chance to straighten out the subterranean mess that is America’s busiest train station.,https://www.nytimes.com/2017/05/04/opinion/penn-station-andrew-cuomo.html
590ad6767c459f24986dda22,861,From Prisoner To Modern-Day Harriet Tubman,OpEd,2017-4-5 7:21:00,"A woman who was once trapped in a cycle of drugs, crime and incarceration now helps others start healthy lives on the outside.",https://www.nytimes.com/2017/05/04/opinion/susan-burton-modern-day-harriet-tubman.html
590ae0227c459f24986dda3b,256,Unknown,Unknown,2017-4-5 8:00:00,"Three teenage photographers from different backgrounds learn the power of visual documentation. &#8220;When I get it right,&#8221; said one of them, &#8220;I kind of feel like I&#8217;m on top of the world.&#8221;",https://lens.blogs.nytimes.com/2017/05/04/the-power-of-photography-for-teenage-documentarians/
590ae6927c459f24986dda4a,455,Questions for: ‘Ivanka Trump Has the President’s Ear. Here’s Her Agenda.’,Learning,2017-4-5 8:30:00,How does Ms. Trump’s role as daughter to the president affect her position as the president’s adviser?,https://www.nytimes.com/2017/05/04/learning/questions-for-ivanka-trump-has-the-presidents-ear-heres-her-agenda.html
590ae7037c459f24986dda4e,1793,President Trump Is the Enemy of Their Enemies,OpEd,2017-4-5 8:31:00,"For many Republican voters, that’s all that matters.",https://www.nytimes.com/2017/05/04/opinion/president-trump-is-the-enemy-of-their-enemies.html
590aeda37c459f24986dda5f,3707,Action at a Distance,Magazine,2017-4-5 9:00:00,"The visual effects industry, and the “movie magic” blockbuster films spend huge shares of their budgets on, are being lured away from California — and into two of the most expensive cities in the world.",https://www.nytimes.com/2017/05/04/magazine/why-hollywoods-most-thrilling-scenes-are-now-orchestrated-thousands-of-miles-away.html
590aeda47c459f24986dda60,668,Unknown,Magazine,2017-4-5 9:00:00,Tracing the strange connections of a global economy.,https://www.nytimes.com/2017/05/04/magazine/the-magazines-money-issue.html
590aeda47c459f24986dda62,978,"Have Pop, Will Travel",Magazine,2017-4-5 9:00:00,"South Korea’s music craze has taken most of the world by storm, but Chile represents a somewhat unlikely conquest.",https://www.nytimes.com/2017/05/04/magazine/what-does-it-take-for-a-k-pop-band-to-blow-up-in-south-america.html
590aeda47c459f24986dda63,744,What Childhood Classic Would You Like to See Turned Into a Movie or TV Show?,Learning,2017-4-5 9:00:00,Are memories of your favorite children’s books enriched or eroded with a Hollywood remake?,https://www.nytimes.com/2017/05/04/learning/what-childhood-classic-would-you-like-to-see-turned-into-a-movie-or-tv-show.html
590afbb97c459f24986dda8f,812,"If Life Has You Down, Do a Handstand",Well,2017-4-5 10:00:00,"A handstand is all about reconnecting with the ground and trusting it in a new way, a white flag of surrender planted in the soil, hands first.",https://www.nytimes.com/2017/05/04/well/move/if-life-has-you-down-do-a-handstand.html
590afd5d7c459f24986dda9b,1142,New York Today: Preparing for President Trump,Metro,2017-4-5 10:07:00,"Thursday: President Trump’s return, Star Wars Day, and a hometown hero.",https://www.nytimes.com/2017/05/04/nyregion/new-york-today-preparing-for-president-trump.html
590b08627c459f24986ddab8,776,Poignant Paper Trail From the Border,Insider,2017-4-5 10:54:00,“Sorry for destroying your door and for having used your belongings ...”,https://www.nytimes.com/2017/05/04/insider/poignant-paper-trail-from-the-south-texas-border.html
590b36d07c459f24986ddb43,912,Don’t Punish Crime Victims,OpEd,2017-4-5 14:12:00,I was shot in the stomach at a parade. Here’s why I refused to cooperate with the prosecution.,https://www.nytimes.com/2017/05/04/opinion/sunday/dont-jail-crime-victims-for-not-testifying.html
590b44ee7c459f24986ddb6a,947,An Ocean Beckons Where Newspapers Once Streamed,Insider,2017-4-5 15:12:00,The pressroom and reel room used by The New York Times until 1997 will reopen in October as National Geographic Encounter: Ocean Odyssey.,https://www.nytimes.com/2017/05/04/insider/an-ocean-beckons-where-newspapers-once-streamed.html
590b4c857c459f24986ddb96,1058,"Wealthy People Benefit, the Poor Much Less So",Upshot,2017-4-5 15:45:00,"The rich and healthy benefit, but poor and disabled people who use Medicaid could lose out.",https://www.nytimes.com/2017/05/04/upshot/who-wins-and-who-loses-in-the-latest-gop-health-care-bill.html
590b52e97c459f24986ddbb1,225,Drugs: Hives May Not Need Steroids,Science,2017-4-5 16:12:00,"Patients with mild itchy rashes did well with an antihistamine alone, a new study reports.",https://www.nytimes.com/2017/05/04/well/live/itchy-hives-a-steroid-may-not-be-needed.html
590b70e97c459f24986ddc23,1473,"Health Care Bill, Passed By House, Faces Senate Test",National,2017-4-5 18:20:00,"After weeks of struggle, House Republicans narrowly passed hard-fought legislation to repeal and replace large parts of the Affordable Care Act.",https://www.nytimes.com/2017/05/04/us/politics/health-care-bill-vote.html
590b861e7c459f24986ddc76,759,Seafood Cocktails to Shock You Back to Life,Dining,2017-4-5 19:50:00,Potent tonics are the draw at a tiny in-store restaurant with a big name (La Esquina del Camarón Mexicano) in Jackson Heights.,https://www.nytimes.com/2017/05/04/dining/la-esquina-del-camaron-mexicano-review.html
590b89f07c459f24986ddc82,855,The Trumpcare Disaster,Editorial,2017-4-5 20:06:00,"Now that Republicans have rammed their health care-destroying bill through the House, Americans have to hope the Senate will stop it.",https://www.nytimes.com/2017/05/04/opinion/obamacare-house-vote.html
590b8cfb7c459f24986ddc8d,910,"An Intimate Portrait, With Blurred Lines",Weekend,2017-4-5 20:20:00,"This Laura Poitras documentary follows the elusive and evasive WikiLeaks founder over several years, but real-time events have overtaken the film’s tale.",https://www.nytimes.com/2017/05/04/movies/risk-review-julian-assange-laura-poitras.html
590b92857c459f24986ddcae,1019,Looking for That Loving Feeling,Weekend,2017-4-5 20:43:00,"Chris Pratt, Zoe Saldana and the crew are back for this sequel to the 2014 hit about a ragtag group of futuristic fighters.",https://www.nytimes.com/2017/05/04/movies/guardians-of-the-galaxy-2-review-chris-pratt.html
590ba0c27c459f24986ddce5,459,Don’t Take the Senate for Granted on Health Care,OpEd,2017-4-5 21:44:00,"The activism around the House bill was impressive, but it ultimately fell short. Now pay attention to the Senate.",https://www.nytimes.com/2017/05/04/opinion/obamacare-repeal-senate.html
590ba2ab7c459f24986ddce9,763,"What I’m Telling You, and Only You",Metropolitan,2017-4-5 21:52:00,"The writer tries out various lies for the bruises on her face, then decides to tell you, and only you, the true story.",https://www.nytimes.com/2017/05/04/nyregion/hiding-cosmetic-surgery-bias.html
590ba3097c459f24986ddcea,830,The Real Problem With the A.H.C.A.,OpEd,2017-4-5 21:54:00,Reducing insurance access isn’t a bug in the Republican plan. It’s a feature.,https://www.nytimes.com/2017/05/04/opinion/gop-health-care-act-.html
590ba4267c459f24986ddcef,1189,Why My Father Votes for Le Pen,OpEd,2017-4-5 21:58:00,The National Front offers a chance to fight his sense of invisibility.,https://www.nytimes.com/2017/05/04/opinion/sunday/why-my-father-votes-for-marine-le-pen.html
590bab867c459f24986ddd0a,967,Service-Based Policing,Metropolitan,2017-4-5 22:30:00,What if New York’s police saw those they are entrusted to serve and protect as consumers who needed to be kept happy?,https://www.nytimes.com/2017/05/04/nyregion/new-york-police-department-customer-service.html
590bb28c7c459f24986ddd1c,1151,A Revival Where Less Is More,Weekend,2017-4-5 23:00:00,"Our new co-chief theater critic, Jesse Green, makes his reviewing debut with this Sondheim musical. Follow him on Twitter (@JesseKGreen) and Facebook (jesse.green.critic).",https://www.nytimes.com/2017/05/04/theater/pacific-overtures-review.html
590bc0887c459f24986ddd2c,292,An Elevator Ride to Remember,Metro,2017-5-5 0:00:00,Spending a few minutes in a confined space with three men accused of being gangsters.,https://www.nytimes.com/2017/05/04/nyregion/metropolitan-diary-elevator-ride-to-remember.html
590bc0987c459f24986ddd2d,911,"Life Will Bury You, but There’s No Use Whining",Weekend,2017-5-5 0:00:00,"Our new co-chief theater critic, Jesse Green, offers his take on Ms. Wiest’s work in this Beckett revival. Follow him on Twitter (@JesseKGreen) and Facebook (jesse.green.critic).",https://www.nytimes.com/2017/05/04/theater/happy-days-review-dianne-wiest.html
590bc81f7c459f24986ddd39,777,Libraries Are Fining Children Who Can’t Afford to Be Without Books,Metro,2017-5-5 0:32:00,"With cards for more than 225,000 young people blocked because of fines exceeding $15, some leaders ask if denying borrowing privileges is the right punishment.",https://www.nytimes.com/2017/05/04/nyregion/library-fines-children-books.html
590bc8367c459f24986ddd3a,456,The Reality of a Pre-Existing Condition,OpEd,2017-5-5 0:32:00,"My family and others have surmounted so many obstacles, only to encounter one we thought was set aside for good.",https://www.nytimes.com/2017/05/04/opinion/pre-existing-condition-gop-bill.html
590bdca97c459f24986ddd56,1027,Instructions on Where to Go,Games,2017-5-5 2:00:00,How to solve a Friday Patrick Berry puzzle.,https://www.nytimes.com/2017/05/04/crosswords/instructions-on-where-to-go-armada-taramasalata.html
590c27ec7c459f24986dddca,840,No Country for This Old Man,OpEd,2017-5-5 7:21:00,"Trump, as president, hasn’t been west of the Mississippi. Now he’s punishing the region, blue and red states alike.",https://www.nytimes.com/2017/05/05/opinion/trump-antiquities-act-utah.html
590c27ff7c459f24986dddcd,818,What’s the Matter With Europe?,OpEd,2017-5-5 7:21:00,"Le Pen must be beaten, but then what?",https://www.nytimes.com/2017/05/05/opinion/european-union-france-election.html
590c381f7c459f24986dddea,337,Questions for: ‘House Passes Measure to Repeal and Replace the Affordable Care Act’,Learning,2017-5-5 8:30:00,"If the American Health Care Act were to become law, how might it affect you and your family?",https://www.nytimes.com/2017/05/05/learning/questions-for-house-passes-measure-to-repeal-and-replace-the-affordable-care-act.html
590c3a517c459f24986dddf3,841,"In Macron, a defense of the Republic",OpEd,2017-5-5 8:39:00,Le Pen would usher France into the mire. Her rebranding is a sham and the National Front still a racist party.,https://www.nytimes.com/2017/05/05/opinion/roger-cohen-french-election-macron-le-pen.html
590c3f1f7c459f24986dde00,425,Is Your Phone Love Hurting Your Relationships?,Learning,2017-5-5 9:00:00,"How to detox from your phone, step by step.",https://www.nytimes.com/2017/05/05/learning/is-your-phone-love-hurting-your-relationships.html
590c3f207c459f24986dde02,544,Endpaper: Homemade,Magazine,2017-5-5 9:00:00,"When patriots demand that things be produced at home, what they get isn’t always exactly what their people want.",https://www.nytimes.com/2017/05/05/magazine/when-countries-think-they-can-go-diy.html
590c3f257c459f24986dde03,1304,How to Make a Company Right a Wrong,Business,2017-5-5 9:00:00,A well-written message to company executives can solve a host of consumer problems. Just follow the model laid out 10 years ago — and use it sparingly.,https://www.nytimes.com/2017/05/05/your-money/the-best-consumer-self-advocacy-tool-youve-never-used.html
590c3f3f7c459f24986dde0d,1879,Joining the Bridge-and-Tunnel Crowd,RealEstate,2017-5-5 9:00:00,"For many people native to the borough, exploring real estate elsewhere in New York City takes a leap of faith.",https://www.nytimes.com/2017/05/05/realestate/new-york-city-real-estate.html
590c3f3e7c459f24986dde0a,986,G.O.P. Cheers a Big Victory.  Has It Stirred a ‘Hornet’s Nest’?,National,2017-5-5 9:00:00,"Democrats saw a mirror image of their own politically disastrous health care experience in 2010, and they also saw an opportunity to possibly recapture the House.",https://www.nytimes.com/2017/05/05/us/politics/house-democrats-health-repeal-republicans.html
590c3f497c459f24986dde0e,4552,The Broken Promise of Choice In New York City High Schools,Metro,2017-5-5 9:00:00,"The city’s high school admissions process was supposed to give every student a real chance to attend a good school. But 14 years in, it has not delivered.",https://www.nytimes.com/2017/05/05/nyregion/school-choice-new-york-city-high-school-admissions.html
590c3f6e7c459f24986dde12,1533,Friday Mailbag: A Columnist Has a Fiery Debut and Another Goes Missing,Editorial,2017-5-5 9:01:00,The first column from The New York Times’s new Op-Ed writer drew a fresh wave of mail. And an artist was unhappy with a past public editor decision.,https://www.nytimes.com/2017/05/05/public-editor/friday-mailbag-a-columnist-has-a-fiery-debut-and-another-goes-missing.html
590c3f6e7c459f24986dde11,1388,Hiring Rise Sends U.S. Jobless Rate To a 10-Year Low,Business,2017-5-5 9:01:00,"The economy added 211,000 jobs in April, the Labor Department said, after weak hiring figures for March. The jobless rate declined to 4.4 percent.",https://www.nytimes.com/2017/05/05/business/economy/jobs-report-unemployment.html
590c462e7c459f24986dde24,474,Teaching With: ‘The Forger’,Learning,2017-5-5 9:30:00,"As a teenager, Adolfo Kaminsky saved thousands of lives by forging passports to help children flee the Nazis. He spent his life helping others escape atrocities around the world.",https://www.nytimes.com/2017/05/05/learning/teaching-with-the-forger.html
590c46337c459f24986dde25,862,Looking for Lessons in the Democrats’ Losses in the 2010 Midterms,Upshot,2017-5-5 9:30:00,"If the past is any guide, the House vote to replace Obamacare could put Republicans at risk in the 2018 midterm elections.",https://www.nytimes.com/2017/05/05/upshot/what-democrats-losses-in-2010-can-tell-us-about-gops-chances-in-2018.html
590c4d2b7c459f24986dde35,1216,Tending My Daughter’s Crown,Well,2017-5-5 10:00:00,"The bond between my daughters and me was carved into intricate lines that framed their cornrows, intertwined in the twists that flew with the wind.",https://www.nytimes.com/2017/05/05/well/family/tending-my-daughters-crown.html
590c4da17c459f24986dde3c,1316,Unknown,Metro,2017-5-5 10:02:00,"Friday: Tweets to Trump, weekend events, and the opening of Governors Island.",https://www.nytimes.com/2017/05/05/nyregion/new-york-today-new-yorkers-on-trump.html
590c5b657c459f24986dde59,2559,The Death and Life of Jersey City,Metropolitan,2017-5-5 11:00:00,"The downtown boom, visible in the new night-life scene along Newark Avenue, poses a threat to the urban pioneers from the city’s grittier days.",https://www.nytimes.com/2017/05/05/nyregion/the-death-and-life-of-jersey-city.html
590c83097c459f24986dded3,809,Full Employment Is Near. What Does It Mean for Pay?,Upshot,2017-5-5 13:49:00,"The best sign that the economy has reached full employment would be if wage gains returned to pre-recession norms. So far, they haven’t.",https://www.nytimes.com/2017/05/05/upshot/were-getting-awfully-close-to-full-employment.html
590c91f37c459f24986ddeff,375,"Classic Mediterranean Flavors, Enlivened by Ramps",Dining,2017-5-5 14:53:00,"Swap out the garlic and try something new with lamb chops, served with a sauce of anchovies, capers and olives.",https://www.nytimes.com/2017/05/05/dining/mediterranean-lamb-chops-recipe.html
590c9c1a7c459f24986ddf28,403,An Unorthodox Union for Asparagus,Dining,2017-5-5 15:36:00,"Adding freekeh, soy sauce and sheep’s milk cheese to an asparagus salad may not be intuitive, but it is delicious.",https://www.nytimes.com/2017/05/05/dining/roasted-asparagus-and-scallion-salad.html
