5906b3197c459f24986dd003,2412,My Beijing: The Sacred City,Travel,2017-1-5 4:01:00,"This metropolis was once a total work of art, epitomizing the religious and political system that ran China for millennia. The remnants of that time are being restored anew.",https://www.nytimes.com/2017/05/01/travel/beijing-china-history-sacred-city-temples-culture.html
5906b3297c459f24986dd004,2318,"6 Million Riders a Day, 1930s Technology",Metro,2017-1-5 4:01:00,New York’s subway is struggling with old infrastructure and overcrowding. The M.T.A.’s failure to modernize its signal system is a crucial example.,https://www.nytimes.com/2017/05/01/nyregion/new-york-subway-signals.html
5906ceec7c459f24986dd021,1795,Seeking a Cross-Border Conference,Sports,2017-1-5 6:00:00,Cetys University is making an ambitious bid to become the first Mexican member of the N.C.A.A.,https://www.nytimes.com/2017/05/01/sports/mexico-cetys-ncaa-border.html
5906cfa77c459f24986dd022,213,"Questions for: ‘Despite the “Yuck Factor,” Leeches Are Big in Russian Medicine’",Learning,2017-1-5 6:03:00,How are leeches used to treat various medical conditions in Russia?,https://www.nytimes.com/2017/05/01/learning/questions-for-despite-the-yuck-factor-leeches-are-big-in-russian-medicine.html
5906e1c07c459f24986dd039,1342,Who Is a ‘Criminal’?,OpEd,2017-1-5 7:20:00,Justice Roberts was right. The Trump administration should not have the power to revoke the citizenship of “anyone they want.”,https://www.nytimes.com/2017/05/01/opinion/who-is-a-criminal.html
5906e1f27c459f24986dd045,885,An Antidote to Europe’s Populism,OpEd,2017-1-5 7:21:00,Beating back the radical right is clearly possible. But the work isn’t done yet.,https://www.nytimes.com/2017/05/01/opinion/populism-has-not-peaked-in-europe-the-fight-continues.html
5906e1f17c459f24986dd044,676,The Cost of a Speech,Editorial,2017-1-5 7:21:00,"In an era of purchased influence, why can’t former President Barack Obama set a higher standard?",https://www.nytimes.com/2017/05/01/opinion/the-cost-of-barack-obamas-speech.html
5906e1f17c459f24986dd042,807,Degradation of the Language,Editorial,2017-1-5 7:21:00,"In Trump world, facts don’t matter, truth doesn’t matter, language doesn’t matter.",https://www.nytimes.com/2017/05/01/opinion/donald-trump-degradation-of-the-language.html
5906e1f17c459f24986dd043,816,On the Power of Being Awful,Editorial,2017-1-5 7:21:00,Trump supporters will never admit they were wrong.,https://www.nytimes.com/2017/05/01/opinion/donald-trump-on-the-power-of-being-awful.html
5906f9307c459f24986dd069,1124,Trump Garbles Pitch on a Revised Health Bill,National,2017-1-5 9:00:00,"President Trump has insisted that the bill would not allow discrimination against people with pre-existing conditions, an assertion contradicted by health policy experts.",https://www.nytimes.com/2017/05/01/us/politics/trump-health-care.html
590700237c459f24986dd079,807,"What’s Going On in This Picture? | May 1, 2017",Learning,2017-1-5 9:30:00,"Look closely at this image, stripped of its caption, and join the moderated conversation about what you and other students see.",https://www.nytimes.com/2017/05/01/learning/whats-going-on-in-this-picture-may-1-2017.html
590700377c459f24986dd07a,816,Unknown,Upshot,2017-1-5 9:30:00,Spinal manipulation and other therapies seem at least as effective and safe as more traditional treatment.,https://www.nytimes.com/2017/05/01/upshot/for-bad-backs-its-time-to-rethink-biases-about-chiropractors.html
5907072a7c459f24986dd085,1070,When Patients Hit a Medical Wall,Science,2017-1-5 10:00:00,A new book details the cases of families that step outside the realm of established medicine because they feel they have no other choice.,https://www.nytimes.com/2017/05/01/well/live/hitting-a-medical-wall-and-turning-to-unproven-treatments.html
590707bb7c459f24986dd088,999,Unknown,Metro,2017-1-5 10:02:00,"Monday: The NYC Ferry launch, the Met Gala, and the PEN America World Voices Festival.",https://www.nytimes.com/2017/05/01/nyregion/new-york-today-citywide-ferry-service-begins.html
590707dd7c459f24986dd089,1101,"For Pregnant Women, Getting Serious About Whooping Cough",Well,2017-1-5 10:03:00,Vaccinating pregnant women is the best way to keep babies safe in the first few months of life.,https://www.nytimes.com/2017/05/01/well/family/for-pregnant-women-getting-serious-about-whooping-cough.html
590715567c459f24986dd09d,1089,Unknown,Upshot,2017-1-5 11:00:00,"The economy and party identification typically matter a lot in elections, even in a year with a highly atypical candidate like Donald Trump.",https://www.nytimes.com/2017/05/01/upshot/the-ways-that-the-2016-election-was-perfectly-normal.html
590752167c459f24986dd11b,677,New York City Transit Reporter in Wonderland: Riding the London Tube,Insider,2017-1-5 15:19:00,“It was like being dropped into an alternate universe where people actually like their subway.”,https://www.nytimes.com/2017/05/01/insider/a-new-york-city-transit-reporter-in-wonderland-riding-the-london-tube.html
590757b27c459f24986dd132,567,How to Cut an Avocado Without Cutting Yourself,Dining,2017-1-5 15:43:00,The popular fruit has earned a dangerous reputation in emergency rooms and doctor’s offices.,https://www.nytimes.com/2017/05/01/dining/avocado-injuries-cutting-safety.html
5907691c7c459f24986dd161,1201,"In Fictional Suicide, Health Experts Say They See a Real Cause for Alarm",Well,2017-1-5 16:57:00,A rising chorus of mental health experts contends that many of the show’s messages on suicide are inaccurate and potentially dangerous.,https://www.nytimes.com/2017/05/01/well/family/for-families-of-teens-at-suicide-risk-13-reasons-triggers-concerns.html
59076d4c7c459f24986dd16e,1135,"Claims of Liberal Media Bias Hit ESPN, Too",Sports,2017-1-5 17:15:00,"Some conservative critics have celebrated ESPN’s struggles, saying its coverage of some issues reveals a left-leaning sensibility.",https://www.nytimes.com/2017/05/01/sports/espn-layoffs-sports-politics-bias.html
5907849b7c459f24986dd1c1,1063,Is the dream in Australia crumbling?,OpEd,2017-1-5 18:55:00,"When you have a nation full of people trying to get to the top, eventually most of the population is forced to run just to keep up.",https://www.nytimes.com/2017/05/01/opinion/the-end-of-the-australian-dream.html
590786d47c459f24986dd1c6,952,Police in Texas Change Account in Officer’s Fatal Shooting of 15-Year-Old,National,2017-1-5 19:04:00,Jordan Edwards was shot late on Saturday when the police in a Dallas suburb were responding to a call reporting young people drinking.,https://www.nytimes.com/2017/05/01/us/dallas-police-teen-shooting.html
59078b7d7c459f24986dd1d5,1122,Most Adults Favor Sex Ed. Most Students Don’t Get It.,Metro,2017-1-5 19:24:00,"A bill before the City Council, backed by reproductive health groups, would create a task force to study sex education and to suggest improvements.",https://www.nytimes.com/2017/05/01/nyregion/sometimes-the-birds-and-the-bees-get-short-shrift-in-school.html
59078fa67c459f24986dd1de,1593,Australia Feels Its Ties to U.S. Put It in a Bind,Foreign,2017-1-5 19:42:00,"Some in Australia worry about the risk of being drawn into a conflict that forces it to side with either the United States, its military ally, or China, its biggest trading partner.",https://www.nytimes.com/2017/05/01/world/australia/trump-north-korea-us-china.html
590793c77c459f24986dd1ee,1513,A Better-Tasting Bird,Dining,2017-1-5 19:59:00,"Prodded by other companies, Perdue, one of America’s biggest poultry producers, is testing a new breed with a healthier life — and a higher cost.",https://www.nytimes.com/2017/05/01/dining/chicken-perdue-slow-growth-breed.html
5907cc0a7c459f24986dd271,142,Everyone’s a Critic on St. Felix Street,Metro,2017-2-5 0:00:00,A scene between two strangers on a sidewalk in the Fort Greene section of Brooklyn.,https://www.nytimes.com/2017/05/01/nyregion/metropolitan-diary-everyones-a-critic-on-st-felix-street.html
5907d1237c459f24986dd281,655,Mr. Trump Embraces Another Despot,Editorial,2017-2-5 0:21:00,His White House invitation to Rodrigo Duterte of the Philippines erodes America’s reputation.,https://www.nytimes.com/2017/05/01/opinion/donald-trump-embraces-rodrigo-duterte.html
5907d8e97c459f24986dd28b,1066,Seeing an Injury Coming At 100 Miles Per Hour,Sports,2017-2-5 0:54:00,"Noah Syndergaard, who throws the hardest fastball among starters, wanted more this season, a goal that was noble, perhaps, but ultimately reckless.",https://www.nytimes.com/2017/05/01/sports/baseball/new-york-mets-noah-syndergaards-injury.html
5907daa07c459f24986dd28d,1264,Trump Overture To North Korea Is Full of Risks,Foreign,2017-2-5 1:02:00,President Trump‘s willingness to meet with the North Korean and Philippine leaders illustrated his confidence in his own deal making but alarmed critics.,https://www.nytimes.com/2017/05/01/world/asia/trump-north-korea-kim-jong-un.html
5907dc837c459f24986dd290,678,From ‘Manipulator’ to Pulitzer Winner,Insider,2017-2-5 1:10:00,The uproar over the hiring of Bret Stephens as a Times columnist recalls the furor that greeted William Safire’s arrival from the Nixon White House.,https://www.nytimes.com/2017/05/01/insider/william-safire-opinion.html
5907dd457c459f24986dd291,1120,Wall Street Shudders As Trump Muses,Business,2017-2-5 1:13:00,"Wall Street shuddered as President Trump, for the first time as resident of the White House, mused that he was considering breaking up the largest banks.",https://www.nytimes.com/2017/05/01/business/sorkin-trump-breaking-up-banks.html
5907e8417c459f24986dd29e,422,Rallying Cry,Games,2017-2-5 2:00:00,David J. Kahn reminds us who is the best.,https://www.nytimes.com/2017/05/01/crosswords/rallying-cry.html
5907ea747c459f24986dd2a2,893,Zika Twins: A Window Into Much More Than a Virus,Insider,2017-2-5 2:09:00,"I did not anticipate the situation of João Lucas and Ana Vitória, whose different fates had overwhelmed their mother and led to the brain-damaged boy being placed with a guardian.",https://www.nytimes.com/2017/05/01/insider/zika-twins-a-window-into-much-more-than-a-virus.html
5907eb227c459f24986dd2a4,375,Le Coucou Named Best New Restaurant at James Beard Awards,Dining,2017-2-5 2:12:00,"Michael Solomonov of Zahav won Outstanding Chef, and from New York, Ghaya Oliveira of Daniel, Blue Hill at Stone Barns and Marco Canora of Hearth took home honors.",https://www.nytimes.com/2017/05/01/dining/james-beard-award-winners-le-coucou-best-new-restaurant.html
5907f7667c459f24986dd2b3,1043,"‘Better Call Saul’ Season 3, Episode 4 Recap: Chicken vs. Ice Cream",Culture,2017-2-5 3:05:00,Add another delightfully villainous “Breaking Bad” character to the growing list whose back stories we’re discovering.,https://www.nytimes.com/2017/05/01/arts/television/better-call-saul-recap-sabrosito.html
590820e57c459f24986dd2ef,83,100 Days,Learning,2017-2-5 6:02:00,What do you think this image is saying? How does it relate to and comment on what is happening in the news right now? What is your opinion of its message?,https://www.nytimes.com/2017/05/02/learning/100-days.html
59082e8f7c459f24986dd30a,1168,"White on the Field, Blue in the Stands",Sports,2017-2-5 7:00:00,"A Times reporter and his sons got an education in soccer, and swearing, in visits to Tottenham’s White Hart Lane.",https://www.nytimes.com/2017/05/02/sports/soccer/soccer-fans-tottenham-cursing.html
590833697c459f24986dd317,1006,America’s Political Disunion,OpEd,2017-2-5 7:21:00,We’re losing a shared consensus of who we are to diverging political narratives.,https://www.nytimes.com/2017/05/02/opinion/the-collapse-of-american-identity.html
5908336e7c459f24986dd31a,754,School Choice  Works While  Vouchers Don’t,OpEd,2017-2-5 7:21:00,"Charters and vouchers, often lumped together, are very different.",https://www.nytimes.com/2017/05/02/opinion/school-vouchers-charters-betsy-devos.html
5908336e7c459f24986dd318,1375,The Great Vietnam War Novel Was Not Written by an American,OpEd,2017-2-5 7:21:00,Literature about the war and its aftermath by Vietnamese and Vietnamese-Americans is plentiful and good. Too few Americans read it.,https://www.nytimes.com/2017/05/02/opinion/vietnam-war-novel-was-not-written-by-an-american.html
59083d287c459f24986dd332,1017,Unknown,Unknown,2017-2-5 8:00:00,"Four decades ago, Jamel Shabazz set out to photograph black and Latino young people in New York City and explore the uplifting power of style, fashion, music and culture.",https://lens.blogs.nytimes.com/2017/05/02/jamel-shabazzs-40-years-of-sights-and-styles-in-new-york/
5908438f7c459f24986dd344,335,"Questions for: ‘Young, Idealistic but Determined, Slovaks Lead Anticorruption Crusade’",Learning,2017-2-5 8:30:00,How did two Slovakian high schoolers start a movement against political corruption?,https://www.nytimes.com/2017/05/02/learning/questions-for-young-idealistic-but-determined-slovaks-lead-anticorruption-crusade.html
59084a9b7c459f24986dd356,568,"What Do You Gain From Pursuing Something You Do Really, Really Badly?",Learning,2017-2-5 9:00:00,What are the hidden benefits of spending time doing something you will never do well?,https://www.nytimes.com/2017/05/02/learning/what-do-you-gain-from-pursuing-something-you-do-really-really-badly.html
59084a9a7c459f24986dd355,997,The Superfood Effect,Magazine,2017-2-5 9:00:00,"Like quinoa before it, açaí has become a craze among health-conscious Americans — creating a bonanza in the regions where it’s grown.",https://www.nytimes.com/2017/05/02/magazine/the-superfood-gold-rush.html
59084aa07c459f24986dd357,6985,The Expansionists,Magazine,2017-2-5 9:00:00,"The rising superpower has built up enormous holdings in poor, resource-rich African countries — but its business partners there aren’t always thrilled.",https://www.nytimes.com/2017/05/02/magazine/is-china-the-worlds-new-colonial-power.html
59084ab67c459f24986dd35c,1461,Battle Lines Outside the Door of the Last Abortion Clinic in Kentucky,National,2017-2-5 9:00:00,"Under a governor who calls himself “unapologetically pro-life,” Kentucky is pushing hard to close its last abortion provider.",https://www.nytimes.com/2017/05/02/us/kentucky-abortion-clinic.html
59084ab67c459f24986dd35d,1332,Navigating A City Forest: 280 Miles Of Scaffolding,Metro,2017-2-5 9:00:00,"The city has taken inventory of more than 7,700 steel-and-wood structures that are intended to ensure public safety, but often become lingering nuisances.",https://www.nytimes.com/2017/05/02/nyregion/new-york-has-280-miles-of-scaffolding-and-a-map-to-navigate-it.html
59084ab67c459f24986dd35b,1932,‘Great Comet’ Shines Bright,Culture,2017-2-5 9:00:00,"“Natasha, Pierre & the Great Comet of 1812” is among four diverse shows that will vie for best new musical. Bette Midler is the front-runner for her role in “Hello, Dolly!”",https://www.nytimes.com/2017/05/02/theater/tony-awards-nominations.html
59084b177c459f24986dd360,756,"A Fantastic, Fantastical Book for the New, Cool Woman in My Life",BookReview,2017-2-5 9:02:00,"Reader, rejoice: People are still wooing each other with books. Our columnist suggests titles to impress a love interest whose tastes run to fantasy.",https://www.nytimes.com/2017/05/02/books/review/match-book-contemporary-fiction-fantasy.html
59084d4c7c459f24986dd363,837,Uncertainty bordering on dismay,OpEd,2017-2-5 9:11:00,An unprecedented and dangerous assault on America’s national conscience.,https://www.nytimes.com/2017/05/02/opinion/trumps-valueless-foreign-policy.html
590851b77c459f24986dd36f,737,How Marching for Science Risks Politicizing It,Upshot,2017-2-5 9:30:00,"If science begins to be seen as a “liberal” pursuit, one researcher said, it risks losing public favor.",https://www.nytimes.com/2017/05/02/upshot/how-marching-for-science-risks-politicizing-it.html
5908589b7c459f24986dd37d,1039,New York Today: Feedback on the Ferry,Metro,2017-2-5 9:59:00,"Tuesday: A boat ride to work, 280 miles of scaffolding, and the opening of the Empire State Building.",https://www.nytimes.com/2017/05/02/nyregion/new-york-today-feedback-on-the-ferry.html
590858bf7c459f24986dd37e,1024,The Phones We Love Too Much,Well,2017-2-5 10:00:00,"If you had to make a choice, would you choose your phone or your partner? Don’t answer that.",https://www.nytimes.com/2017/05/02/well/mind/the-phones-we-love-too-much.html
590866ba7c459f24986dd3a1,1033,When the Prize Money Goes to the Least Likely,Well,2017-2-5 11:00:00,Bobby Crim has turned a star-studded race into one that now caters to the people of his hometown.,https://www.nytimes.com/2017/05/02/well/move/when-the-prize-money-goes-to-the-least-likely.html
5908714b7c459f24986dd3bd,2599,Did Tabloids Cause ‘Brexit’? It’s Covered With Inky Fingerprints,Foreign,2017-2-5 11:45:00,"Despite their falling circulations and tarnished reputations, tabloids maintain a striking grip on power as Britain prepares to cut ties with the European Union.",https://www.nytimes.com/2017/05/02/world/europe/london-tabloids-brexit.html
59088fdc7c459f24986dd418,1432,"Trump, in Wake of Deal to Avoid a Shutdown Now, Calls for One Later",National,2017-2-5 13:55:00,"In two Twitter posts, the president appeared to defend a spending package that Congress is considering that fails to accomplish many of his goals.",https://www.nytimes.com/2017/05/02/us/politics/good-shutdown-congress-trump.html
5908a21b7c459f24986dd45c,1263,Trump and Putin  Agree to Pursue  Syria Cease-Fire,Foreign,2017-2-5 15:13:00,"In their first conversation since last month’s rupture over Syria, President Trump said he would send a representative to Russian-sponsored talks.",https://www.nytimes.com/2017/05/02/world/europe/trump-putin-syria.html
5908ab477c459f24986dd475,1568,G.O.P. Scrambles As Crucial Voice Shuns Care Bill,National,2017-2-5 15:52:00,Representative Fred Upton of Michigan said he wants more money to protect people with pre-existing medical conditions endangered by the latest health care repeal bill.,https://www.nytimes.com/2017/05/02/us/politics/health-care-paul-ryan-fred-upton-congress.html
5908ad0b7c459f24986dd47b,447,A One-Day Crossword Internship,Games,2017-2-5 16:00:00,"Chloe Rosenfeld, a high school senior from the Bronx, N.Y., reports on her day learning the ropes from Will Shortz and Joel Fagliano.",https://www.nytimes.com/2017/05/02/crosswords/a-one-day-crossword-internship-shortz.html
5908b0337c459f24986dd487,1132,A Vegetable Patch of His Own,Dining,2017-2-5 16:13:00,"Dan Kluger’s new restaurant in Greenwich Village leans heavily on grains and seasonal produce, evoking his work at ABC Kitchen.",https://www.nytimes.com/2017/05/02/dining/loring-place-review-greenwich-village.html
5908bf397c459f24986dd4ba,2457,When Flamethrowers Like Ann Coulter Come to Campus,Automobiles,2017-2-5 17:17:00,Six students weigh in.,https://www.nytimes.com/2017/05/02/opinion/a-controversial-speaker-comes-to-campus-what-do-you-do.html
5908ce2f7c459f24986dd4e5,2076,Chef at a Crossroads,Dining,2017-2-5 18:21:00,"At 61, with big projects nearing completion on both coasts, the influential founder of the French Laundry contemplates his next chapter.",https://www.nytimes.com/2017/05/02/dining/thomas-keller-chef-profile.html
5908d31d7c459f24986dd4f4,943,Clinton Attacks Trump as Struggling and Unprepared,National,2017-2-5 18:42:00,"Hillary Clinton sharply questioned President Trump’s conduct in office, criticizing his foreign policy pronouncements and penchant for posting on Twitter.",https://www.nytimes.com/2017/05/02/us/clinton-trump-interview.html
5908d52e7c459f24986dd4f8,1196,Stopping the lone wolves,OpEd,2017-2-5 18:51:00,Terrorism has outmaneuvered law enforcement. But the government can do more than fight with raw power.,https://www.nytimes.com/2017/05/02/opinion/australia-lone-wolf-terrorists-waleed-aly.html
5908d8227c459f24986dd504,738,"The Rise of the $38 Pizza, Exclusive and Elusive",Dining,2017-2-5 19:03:00,"You’ve heard of the $1 slice? This is another kind of New York pizza, from a Sutton Place shop that has started selling tickets for the experience.",https://www.nytimes.com/2017/05/02/dining/pizza-expensive-sofia-shoppe-nyc.html
5908dc8e7c459f24986dd51c,1280,"‘The Handmaid’s Tale’ Season 1, Episode 3: Gender Treachery",Culture,2017-2-5 19:22:00,This is the strongest episode of “The Handmaid’s Tale” yet but it’s held back from greatness by a near-fatal flaw.,https://www.nytimes.com/2017/05/02/arts/television/the-handmaids-tale-episode-3-recap.html
5908e1e17c459f24986dd52f,492,First Night in America,OpEd,2017-2-5 19:45:00,Refugees from around the world spend their first night in the U.S. at an airport hotel.,https://www.nytimes.com/2017/05/02/opinion/hotel-usa-refugee-op-doc.html
5908e5827c459f24986dd538,437,"A Search for Dad, Along With Nessie",Culture,2017-2-5 19:59:00,"In this collaborative work by the company Bucket Club, a sighting of the mythical monster forces an evolutionary biologist to confront her unhappy past.",https://www.nytimes.com/2017/05/02/theater/review-a-search-for-dad-and-the-loch-ness-monster-in-fossils.html
5908e7f07c459f24986dd53f,971,French Toast  Worth Staying At Home For,Dining,2017-2-5 20:11:00,"You don’t have to wait in line in the rain. A rich, fluffy version with a lacy, crisp crust is right at hand.",https://www.nytimes.com/2017/05/02/dining/french-toast-recipe-video.html
5908ea5d7c459f24986dd54a,999,How to Say ‘New Life’ in German,Insider,2017-2-5 20:21:00,"For almost a year, Times reporters followed the process of refugee integration in Weimar, home to both Goethe and Buchenwald.",https://www.nytimes.com/2017/05/02/insider/what-makes-good-neighbors-in-one-german-city-it-might-not-be-the-fences.html
59091d8e7c459f24986dd5bb,86,Making Change at the Bank,Metro,2017-3-5 0:00:00,"Sometimes, the line for the teller just takes too long.",https://www.nytimes.com/2017/05/02/nyregion/metropolitan-diary-making-change-at-the-bank.html
59091de37c459f24986dd5bf,970,An Industry in Reverse,Business,2017-3-5 0:01:00,"A fourth straight monthly sales decline, at a rate exceeding forecasts, put a dent in automakers’ shares. “The market is tapped out,” a dealer said.",https://www.nytimes.com/2017/05/02/business/auto-sales-decline.html
590939bd7c459f24986dd5de,415,A High Bar to Reach,Games,2017-3-5 2:00:00,Alan Arbesfeld makes an interesting point.,https://www.nytimes.com/2017/05/02/crosswords/a-high-bar-to-reach.html
590948037c459f24986dd5eb,1138,"‘The Americans’ Season 5, Episode 9 Recap: Tuan on the Bus",Culture,2017-3-5 3:01:00,"A lot of agita, but still not a lot of action on this week’s episode.",https://www.nytimes.com/2017/05/02/arts/television/the-americans-ihop-recap.html
590955e27c459f24986dd5f9,1053,A Flashier Cricket Faces the Specter of Doping,Sports,2017-3-5 4:00:00,The suspensions of two star players have raised concerns that Twenty20 may be bringing the threat of doping along with its explosion of cash.,https://www.nytimes.com/2017/05/03/sports/cricket/specter-of-doping-accompanies-a-flashier-form-of-cricket.html
590984b07c459f24986dd65e,1008,"My Medicaid, My Life",OpEd,2017-3-5 7:20:00,It is more than a health care program. It is a life-giving one. And I am proof.,https://www.nytimes.com/2017/05/03/opinion/my-medicaid-my-life.html
590984e77c459f24986dd65f,593,The State Department Deserves Better,Editorial,2017-3-5 7:21:00,One of the agencies most responsible for managing the chaos needs to have a stable senior staff.,https://www.nytimes.com/2017/05/03/opinion/the-state-department-deserves-better.html
590984e97c459f24986dd660,881,"Trump: Crazy Like a Fox,  Or Just Crazy?",OpEd,2017-3-5 7:21:00,The president’s remarks about his first 100 days have been simply bizarre.,https://www.nytimes.com/2017/05/03/opinion/trump-crazy-like-a-fox-or-just-crazy.html
590984ea7c459f24986dd662,1593,The European Crisis,OpEd,2017-3-5 7:21:00,Why the Continent’s populists have stronger grievances than ours.,https://www.nytimes.com/2017/05/03/opinion/european-populist-marine-le-pen.html
59098ee57c459f24986dd67d,519,Unknown,Unknown,2017-3-5 8:00:00,"Marcia Bricker Halperin&#8217;s photos of New York&#8217;s long-gone cafeterias show their graceful architecture, moody lighting and the characters who frequented them.",https://lens.blogs.nytimes.com/2017/05/03/in-new-yorks-automats-a-cup-of-coffee-and-community/
590995197c459f24986dd691,363,Questions for: ‘Shaming Children So Parents Will Pay the School Lunch Bill’,Learning,2017-3-5 8:30:00,"Should school meals be offered free to all children, regardless of income?",https://www.nytimes.com/2017/05/03/learning/questions-for-shaming-children-so-parents-will-pay-the-school-lunch-bill.html
59099c197c459f24986dd6a5,959,The Hookup,Magazine,2017-3-5 9:00:00,Services like Wish — through which American consumers can mainline goods directly from the manufacturing chaos of China — are harbingers of the end of retail as we know it.,https://www.nytimes.com/2017/05/03/magazine/the-online-marketplace-thats-a-portal-to-the-future-of-capitalism.html
59099c1f7c459f24986dd6a8,671,"Is ‘13 Reasons Why’ Raising Awareness About Teenage Suicide, or Glamorizing It?",Learning,2017-3-5 9:00:00,How would you help a friend who had suicidal thoughts?,https://www.nytimes.com/2017/05/03/learning/is-13-reasons-why-raising-awareness-about-teenage-suicide-or-glamorizing-it.html
59099c1e7c459f24986dd6a6,4674,The Caregivers,Magazine,2017-3-5 9:00:00,"To support their families back home, women from the Philippines have found work and a new way of life in Israel. But at what price?",https://www.nytimes.com/2017/05/03/magazine/israels-invisible-filipino-work-force.html
